YEAR,TITLE,AUTHOR,ABSTRACT
2018,A Deep Learning Approach to Digitally Stain Optical Coherence Tomography Images of the Optic Nerve Head,"Devalla, SK; Chin, KS; Mari, JM; Tun, TA; Strouthidis, NG; Aung, T; Thiery, AH; Girard, MJA","PURPOSE. To develop a deep learning approach to digitally stain optical coherence tomography (OCT) images of the optic nerve head (ONH). METHODS. A horizontal B-scan was acquired through the center of the ONH using OCT (Spectralis) for one eye of each of 100 subjects (40 healthy and 60 glaucoma). All images were enhanced using adaptive compensation. A custom deep learning network was then designed and trained with the compensated images to digitally stain (i.e., highlight) six tissue layers of the ONH. The accuracy of our algorithm was assessed (against manual segmentations) using the dice coefficient, sensitivity, specificity, intersection over union (IU), and accuracy. We studied the effect of compensation, number of training images, and performance comparison between glaucoma and healthy subjects. RESULTS. For images it had not yet assessed, our algorithm was able to digitally stain the retinal nerve fiber layer + prelamina, the RPE, all other retinal layers, the choroid, and the peripapillary sclera and lamina cribrosa. For all tissues, the dice coefficient, sensitivity, specificity, IU, and accuracy (mean) were 0.84 +/- 0.03, 0.92 +/- 0.03, 0.99 +/- 0.00, 0.89 +/- 0.03, and 0.94 +/- 0.02, respectively. Our algorithm performed significantly better when compensated images were used for training (P < 0.001). Besides offering a good reliability, digital staining also performed well on OCT images of both glaucoma and healthy individuals. CONCLUSIONS. Our deep learning algorithm can simultaneously stain the neural and connective tissues of the ONH, offering a framework to automatically measure multiple key structural parameters of the ONH that may be critical to improve glaucoma management."
2018,A Distributed Snapshot Protocol for Efficient Artificial Intelligence Computation in Cloud Computing Environments,"Lim, J; Gil, JM; Yu, H","Many artificial intelligence applications often require a huge amount of computing resources. As a result, cloud computing adoption rates are increasing in the artificial intelligence field. To support the demand for artificial intelligence applications and guarantee the service level agreement, cloud computing should provide not only computing resources but also fundamental mechanisms for efficient computing. In this regard, a snapshot protocol has been used to create a consistent snapshot of the global state in cloud computing environments. However, the existing snapshot protocols are not optimized in the context of artificial intelligence applications, where large-scale iterative computation is the norm. In this paper, we present a distributed snapshot protocol for efficient artificial intelligence computation in cloud computing environments. The proposed snapshot protocol is based on a distributed algorithm to run interconnected multiple nodes in a scalable fashion. Our snapshot protocol is able to deal with artificial intelligence applications, in which a large number of computing nodes are running. We reveal that our distributed snapshot protocol guarantees the correctness, safety, and liveness conditions."
2018,A Dynamic Three-way Decision Model based on the Updating of Attribute Values,"Zhang, QH; Lv, GX; Chen, YH; Wang, GY","The three-way decision model is a topic of substantial research interest in the field of artificial intelligence, and many researchers have focused on to its feasibility and rationality. The tolerance and practicability of the three-way decision model are better than those of the two-way decision model. When the attribute value of each object in a domain is given, the formation of a three-way classification of the domain is a key issue. However, few studies have been conducted on establishing a three-way decision model with the given attribute values in the case where the number of objects in an accepted region is given. Therefore, in the model presented in this paper, both the uncertainty of attribute values and the cost of updating are fully considered. In this paper, first, a new concept of attribute ratio is defined to describe an object when the attribute value of the object is numerical, and then, a dynamic three-way decision model is established. Second, a feature extraction algorithm of attribute values is proposed, and a pair of decision thresholds of the dynamic three-way decision model is also obtained according to the given conditions. Then, in the case where the attribute values are updated, an example is provided to demonstrate how two-way classification results can be obtained in the dynamic decision-making process. Finally, the results of simulation experiments show that the proposed model is feasible and effective in practical applications. When the number of objects in an accepted region has been given, according to the updating strategy of attribute values, the three-way decision problems are successfully solved by the proposed model. (C) 2017 Elsevier B.V. All rights reserved."
2018,A Fuzzy based Soft Computing Technique to Predict the Movement of the Price of a Stock,"Dutta, AK","Soft computing is a part of an artificial intelligence, and fuzzy logic is the study of fuzziness on data. The combination of these two techniques can provide an intelligent system with more ability and flexibility. The nature of data in the stock/capital market is more complex and challenging to predict the movement of the price of the stock. The study has combined both fuzzy c-means and neural network technique for the prediction of the price of the stock. The research finds an optimum solution to predict the future price of a stock. The comparison of time and space complexity proved that the proposed method is better than the existing methods."
2018,A fuzzy logic navigation controller implemented in hardware for an electric wheelchair,"Rojas, M; Ponce, P; Molina, A","In this article, we present an obstacle avoidance controller implemented in a field programmable gate array for an electric wheelchair. It is based on a traditional approach with ultrasonic sensors and fuzzy logic. Various tests were conducted to characterize the prototype and to evaluate the controller performance. The results showed that the system is able to acquire data from sensors and make decisions 46.16 times per second. The sensors' coverage extends 3 m to the front, rear, left, and right sides of the wheelchair; moreover, the sensors detect 0.95-cm diameter objects at 40 cm. The power consumption was evaluated, and it was found that the hardware architecture reduces the battery life by only 0.87%. Furthermore, the controller helped to navigate in confined areas, avoiding obstacles with cautious movements and decreasing the likelihood of collision. The proposed methodology uses data from eight sonars distributed around the wheelchair to make navigation decisions, besides the hardware-based architecture guarantees real-time control and on-time response."
2018,A Fuzzy-Based Building Energy Management System for Energy Efficiency,"Hernandez, JL; Sanz, R; Corredera, A; Palomar, R; Lacave, I","Information and communication technologies (ICT) offer immense potential to improve the energetic performance of buildings. Additionally, common building control systems are typically based on simple decision-making tools, which possess the ability to obtain controllable parameters for indoor temperatures. Nevertheless, the accuracy of such common building control systems is improvable with the integration of advanced decision-making techniques embedded into software and energy management tools. This paper presents the design of a building energy management system (BEMS), which is currently under development, and that makes use of artificial intelligence for the automated decision-making process required for optimal comfort of occupants and utilization of renewables for achieving energy-efficiency in buildings. The research falls under the scope of the H2020 project BREASER which implements fuzzy logic with the aim of governing the energy resources of a school in Turkey, which has been renovated with a ventilated facade with integrated renewable energy sources (RES). The BRESAER BEMS includes prediction techniques that increase the accuracy of common BEMS tools, and subsequent energy savings, while ensuring the indoor thermal comfort of the building occupants. In particular, weather forecast and simulation strategies are integrated into the functionalities of the overall system. By collecting the aforementioned information, the BEMS makes decisions according to a well-established selection of key performance indicators (KPIs) with the objective of providing a quantitative comparable value to determine new actuation parameters."
2017,A generative vision model that trains with high data efficiency and breaks text-based CAPTCHAs,"George, D; Lehrach, W; Kansky, K; Lazaro-Gredilla, M; Laan, C; Marthi, B; Lou, XH; Meng, ZS; Liu, Y; Wang, HY; Lavin, A; Phoenix, DS","Learning from a few examples and generalizing to markedly different situations are capabilities of human visual intelligence that are yet to be matched by leading machine learning models. By drawing inspiration from systems neuroscience, we introduce a probabilistic generative model for vision in which message-passing-based inference handles recognition, segmentation, and reasoning in a unified way. The model demonstrates excellent generalization and occlusion-reasoning capabilities and outperforms deep neural networks on a challenging scene text recognition benchmark while being 300-fold more data efficient. In addition, the model fundamentally breaks the defense of modern text-based CAPTCHAs (Completely Automated Public Turing test to tell Computers and Humans Apart) by generatively segmenting characters without CAPTCHA-specific heuristics. Our model emphasizes aspects such as data efficiency and compositionality that may be important in the path toward general artificial intelligence."
2018,A Hermite neural network incorporating artificial bee colony optimization to model shoreline realignment at a reef-fronted beach,"Tsekouras, GE; Trygonis, V; Maniatopoulos, A; Rigos, A; Chatzipavlis, A; Tsimikas, J; Mitianoudis, N; Velegrakis, AF","This paper investigates the potential of using a novel Hermite polynomial neural network to model shoreline realignment along an urban beach fronted by a highly irregular beachrock reef. Modeling takes place on the basis of a number of input variables related to reef morphology and wave forcing, whereas the output variable is time series of shoreline position that have been recorded in high spatio-temporal resolution using a coastal video monitoring system. The main network functionality is the generation of Hermite truncated polynomial series of linear combinations of the input variables, and output is calculated as the weighted sum of these truncated series. It is shown that the proposed network can approximate any continuous function defined on a compact set of the multidimensional Euclidean space to arbitrary accuracy. The network is optimized in terms of a modified artificial bee colony method. For comparative reasons, three more related neural networks have been tested that have been optimized by employing different swarm intelligence-based algorithms. Comparison between the four networks has been carried out by standard performance criteria and detailed parametric statistical analysis. Main results of the study are: (a) polynomial orders 3 and 4 are able to effectively handle reasonably well the high nonlinear effects imposed by the presence of the reef; (b) the statistical analysis indicates that the proposed network outperforms the other networks tested; and (c) model efficiency improves noticeably when beach sections behind reef inlets and/or particular wide sections of the reef that introduce high shoreline variability are not considered. (c) 2017 Elsevier B.V. All rights reserved."
2018,A High Precision Artificial Neural Networks Model for Short-Term Energy Load Forecasting,"Kuo, PH; Huang, CJ","One of the most important research topics in smart grid technology is load forecasting, because accuracy of load forecasting highly influences reliability of the smart grid systems. In the past, load forecasting was obtained by traditional analysis techniques such as time series analysis and linear regression. Since the load forecast focuses on aggregated electricity consumption patterns, researchers have recently integrated deep learning approaches with machine learning techniques. In this study, an accurate deep neural network algorithm for short-term load forecasting (STLF) is introduced. The forecasting performance of proposed algorithm is compared with performances of five artificial intelligence algorithms that are commonly used in load forecasting. The Mean Absolute Percentage Error (MAPE) and Cumulative Variation of Root Mean Square Error (CV-RMSE) are used as accuracy evaluation indexes. The experiment results show that MAPE and CV-RMSE of proposed algorithm are 9.77% and 11.66%, respectively, displaying very high forecasting accuracy."
2017,A HIGH-PERFORMANCE COMPUTING (HPC) BASED INTEGRATED MULTITHREADED MODEL PREDICTIVE CONTROL (MPC) FOR WATER SUPPLY NETWORKS,"Gaska, K; Generowicz, A; Zimoch, I; Ciula, J; Iwanicka, Z","The article presents the concept of an intelligent system of multithreaded, hierarchical predictive control of water supply and sewage networks using a parallel computational architecture. The predominant element of the proposed control system over other hitherto functioning systems is the element of predicting future events (MPC model). This feature, combined with the self-learning intelligent control system, not only allows you to react to changes in sensor state, but also anticipate these changes and adjust the system in advance to prepare for predicted situation, which is particularly important in systems with high inertia as extensive water supply and sewage networks. The technologically advanced solutions proposed by the authors, ie the HPC (High Performance Computing) ICT system, including the requesting module allows (by analyzing the space of states and events in real time) to predict future behaviors of individual elements of the system and effectively react to unknown cases, supporting the making of strategic decisions."
2017,A HYBRID INTELLIGENT MODEL FOR TOURISM DEMAND FORECASTING,"Kulshrestha, A; Kulshrestha, A; Suman, S","The ever increasing demand of the tourism sector worldwide has led to an increase in tourism demand forecasting methodologies. New techniques yield much reliable predictions of tourist arrivals for better economic planning. The study aims to forecast and compare the performance of two non-linear artificial intelligence approaches in predicting the number of tourist arrivals to Singapore. The Singapore inbound monthly tourism data were utilized to generate one, two, four and six month ahead forecasts with non-linear autoregressive (NAR) neural networks and neuro-fuzzy systems. The predictive accuracy of NAR neural networks and neuro-fuzzy systems were compared with various performance metrics. The study revealed that neuro-fuzzy systems outperformed NAR networks in all forecasting horizons and for all countries. The proposed neuro-fuzzy methodology helps in improving the forecasting performance of artificial intelligence based techniques. The study contributes to hospitality literature and could be utilized by managers to effectively plan and implement tourism related policy measures."
